{
  "decision_id": "smr_01J00000000000000000000000",
  "case_id": "src_01J00000000000000000000000",
  "operation_id": "sop_01J00000000000000000000000",
  "decision": "resolve_success",
  "operator_principal": "principal:platform-operator",
  "evidence_references": [
    "audit://sandbox/provider-query/0001"
  ],
  "reason": "Provider evidence confirms the operation completed successfully.",
  "risk_accepted": false,
  "occurred_at": "2026-07-16T10:07:00Z",
  "decision_digest": "sha256:0553b19ac35a31ce81eb30b8d7373887a802a8c6a26cac7f467698e4806325da"
}
